{
  "$schema": "http://json-schema.org/draft-07/schema#",
  "$id": "https://shipledger.dev/schemas/notes.schema.json",
  "definitions": {
    "note": { "type": "string", "pattern": "\\S" },
    "sha": { "type": "string", "pattern": "^(?:[0-9a-f]{40}|[0-9a-f]{64})$" }
  },
  "type": "object",
  "additionalProperties": false,
  "required": ["version"],
  "properties": {
    "version": { "enum": [1, 2] },
    "noReference": {
      "type": "array",
      "items": {
        "type": "object",
        "additionalProperties": false,
        "required": ["repo", "sha", "classification", "note"],
        "properties": {
          "repo": { "type": "string", "minLength": 1 },
          "sha": { "$ref": "#/definitions/sha" },
          "classification": { "enum": ["revert", "dependency-bump", "hotfix-already-released", "tooling-or-ci", "process-miss", "security-advisory"] },
          "impact": { "enum": ["test-only", "no-runtime-impact"] },
          "note": { "$ref": "#/definitions/note" }
        }
      }
    },
    "unknownReference": {
      "type": "array",
      "items": {
        "type": "object",
        "additionalProperties": false,
        "required": ["repo", "sha", "classification", "note"],
        "dependencies": { "matcher": ["token"], "token": ["matcher"] },
        "properties": {
          "repo": { "type": "string", "minLength": 1 },
          "sha": { "$ref": "#/definitions/sha" },
          "matcher": { "type": "string", "minLength": 1 },
          "token": { "type": "string", "minLength": 1 },
          "classification": { "enum": ["other-release", "typo", "wrongly-omitted"] },
          "impact": { "enum": ["test-only", "no-runtime-impact"] },
          "note": { "$ref": "#/definitions/note" }
        }
      }
    },
    "items": {
      "type": "array",
      "items": {
        "type": "object",
        "additionalProperties": false,
        "required": ["item", "classification", "note"],
        "properties": {
          "item": { "type": "string", "minLength": 1 },
          "classification": { "enum": ["configuration-only", "documentation-only", "landed-earlier", "wrongly-tagged", "not-done", "merged-via-another-change"] },
          "impact": { "enum": ["test-only", "no-runtime-impact"] },
          "note": { "$ref": "#/definitions/note" }
        }
      }
    },
    "ranges": {
      "type": "array",
      "items": {
        "type": "object",
        "additionalProperties": false,
        "required": ["repo", "classification", "note"],
        "properties": {
          "repo": { "type": "string", "minLength": 1 },
          "classification": { "enum": ["expected-divergence", "wrong-base"] },
          "impact": { "enum": ["test-only", "no-runtime-impact"] },
          "note": { "$ref": "#/definitions/note" }
        }
      }
    }
  },
  "if": {
    "properties": { "version": { "const": 1 } }
  },
  "then": {
    "properties": {
      "noReference": { "type": "array", "items": { "type": "object", "properties": { "impact": false } } },
      "unknownReference": { "type": "array", "items": { "type": "object", "properties": { "impact": false } } },
      "items": { "type": "array", "items": { "type": "object", "properties": { "impact": false } } },
      "ranges": { "type": "array", "items": { "type": "object", "properties": { "impact": false } } }
    }
  }
}
